{
  "schema_version": 1,
  "package": "credit_default",
  "version": "1.0",
  "configuration": "plain_llm",
  "run_id": "credit_default-plain_llm-20260918T181308Z-6e98ce62",
  "illustrative": false,
  "tolerances": {
    "abs_tol_unit_interval": 0.005,
    "abs_tol_percent_0_100": 0.5,
    "rel_tol_other": 0.01
  },
  "grounding": {
    "pre_repair": {
      "precision": 0.0,
      "n_claims": 82,
      "status_counts": {
        "verified": 0,
        "mismatch": 0,
        "unsupported": 53,
        "dangling": 29,
        "unattributed": 0
      },
      "per_section": {
        "summary": {
          "verified": 0,
          "n_claims": 7,
          "precision": 0.0
        },
        "conceptual_soundness": {
          "verified": 0,
          "n_claims": 14,
          "precision": 0.0
        },
        "data_integrity": {
          "verified": 0,
          "n_claims": 10,
          "precision": 0.0
        },
        "outcomes": {
          "verified": 0,
          "n_claims": 33,
          "precision": 0.0
        },
        "sensitivity": {
          "verified": 0,
          "n_claims": 6,
          "precision": 0.0
        },
        "findings": {
          "verified": 0,
          "n_claims": 3,
          "precision": 0.0
        },
        "monitoring": {
          "verified": 0,
          "n_claims": 9,
          "precision": 0.0
        }
      }
    },
    "post_repair": {
      "precision": 0.0,
      "n_claims": 82,
      "status_counts": {
        "verified": 0,
        "mismatch": 0,
        "unsupported": 53,
        "dangling": 29,
        "unattributed": 0
      },
      "per_section": {
        "summary": {
          "verified": 0,
          "n_claims": 7,
          "precision": 0.0
        },
        "conceptual_soundness": {
          "verified": 0,
          "n_claims": 14,
          "precision": 0.0
        },
        "data_integrity": {
          "verified": 0,
          "n_claims": 10,
          "precision": 0.0
        },
        "outcomes": {
          "verified": 0,
          "n_claims": 33,
          "precision": 0.0
        },
        "sensitivity": {
          "verified": 0,
          "n_claims": 6,
          "precision": 0.0
        },
        "findings": {
          "verified": 0,
          "n_claims": 3,
          "precision": 0.0
        },
        "monitoring": {
          "verified": 0,
          "n_claims": 9,
          "precision": 0.0
        }
      }
    }
  },
  "repairs": [],
  "pre_repair": [
    {
      "text": "This report documents an independent validation of package `credit_default` version 1.0, a binary classification model estimating the probability of a client defaulting in the following month (`default_next_month`). The subject is a standardised logistic regression with eleven retained predictors, an intercept of -6.1028, fitted on 3,500 training rows and evaluated on 1,500 test rows [[art:e4b3fd0e:run.model_summary]], [[art:3b6b0a38:run.splits]].",
      "value": -6.1028,
      "unit": "ratio",
      "metric": "coefficient",
      "split": null,
      "comparison": "eq",
      "citation": "[[art:e4b3fd0e:run.model_summary]]",
      "rounding": null,
      "section": "summary",
      "id": "731c141bbcc81d7d",
      "source": "report",
      "status": "dangling",
      "artifact_value": null,
      "tolerance": 0.0
    },
    {
      "text": "This report documents an independent validation of package `credit_default` version 1.0, a binary classification model estimating the probability of a client defaulting in the following month (`default_next_month`). The subject is a standardised logistic regression with eleven retained predictors, an intercept of -6.1028, fitted on 3,500 training rows and evaluated on 1,500 test rows [[art:e4b3fd0e:run.model_summary]], [[art:3b6b0a38:run.splits]].",
      "value": 3500.0,
      "unit": "count",
      "metric": "n_train",
      "split": "train",
      "comparison": "eq",
      "citation": "[[art:3b6b0a38:run.splits]]",
      "rounding": null,
      "section": "summary",
      "id": "ebb583079fcefe1b",
      "source": "report",
      "status": "dangling",
      "artifact_value": null,
      "tolerance": 0.0
    },
    {
      "text": "This report documents an independent validation of package `credit_default` version 1.0, a binary classification model estimating the probability of a client defaulting in the following month (`default_next_month`). The subject is a standardised logistic regression with eleven retained predictors, an intercept of -6.1028, fitted on 3,500 training rows and evaluated on 1,500 test rows [[art:e4b3fd0e:run.model_summary]], [[art:3b6b0a38:run.splits]].",
      "value": 1500.0,
      "unit": "count",
      "metric": "n_test",
      "split": "test",
      "comparison": "eq",
      "citation": "[[art:3b6b0a38:run.splits]]",
      "rounding": null,
      "section": "summary",
      "id": "aef28c76ce954012",
      "source": "report",
      "status": "dangling",
      "artifact_value": null,
      "tolerance": 0.0
    },
    {
      "text": "The headline conclusion is that the model **should not be used as it stands**. Its reported performance \u2014 test AUC 0.9755, KS 0.8784, Brier 0.0425 against a 22.5% event rate \u2014 is not attainable on a genuine forward-looking consumer default problem and is, in our assessment, the signature of target leakage through the predictor `pay_amt_next`. Every downstream outcome in this report is contaminated by that defect, so the discrimination, calibration and stability results below should be read as descriptions of a leaking model, not as evidence of predictive skill.",
      "value": 0.9755,
      "unit": "ratio",
      "metric": "auc",
      "split": "test",
      "comparison": "eq",
      "citation": null,
      "rounding": null,
      "section": "summary",
      "id": "98fe4c8226897979",
      "source": "report",
      "status": "unsupported",
      "artifact_value": null,
      "tolerance": 5e-05
    },
    {
      "text": "The headline conclusion is that the model **should not be used as it stands**. Its reported performance \u2014 test AUC 0.9755, KS 0.8784, Brier 0.0425 against a 22.5% event rate \u2014 is not attainable on a genuine forward-looking consumer default problem and is, in our assessment, the signature of target leakage through the predictor `pay_amt_next`. Every downstream outcome in this report is contaminated by that defect, so the discrimination, calibration and stability results below should be read as descriptions of a leaking model, not as evidence of predictive skill.",
      "value": 0.8784,
      "unit": "ratio",
      "metric": "ks",
      "split": "test",
      "comparison": "eq",
      "citation": null,
      "rounding": null,
      "section": "summary",
      "id": "9d45bba50a8c8baf",
      "source": "report",
      "status": "unsupported",
      "artifact_value": null,
      "tolerance": 5e-05
    },
    {
      "text": "The headline conclusion is that the model **should not be used as it stands**. Its reported performance \u2014 test AUC 0.9755, KS 0.8784, Brier 0.0425 against a 22.5% event rate \u2014 is not attainable on a genuine forward-looking consumer default problem and is, in our assessment, the signature of target leakage through the predictor `pay_amt_next`. Every downstream outcome in this report is contaminated by that defect, so the discrimination, calibration and stability results below should be read as descriptions of a leaking model, not as evidence of predictive skill.",
      "value": 0.0425,
      "unit": "ratio",
      "metric": "brier",
      "split": "test",
      "comparison": "eq",
      "citation": null,
      "rounding": null,
      "section": "summary",
      "id": "27918d3c66cb3c04",
      "source": "report",
      "status": "unsupported",
      "artifact_value": null,
      "tolerance": 5e-05
    },
    {
      "text": "The headline conclusion is that the model **should not be used as it stands**. Its reported performance \u2014 test AUC 0.9755, KS 0.8784, Brier 0.0425 against a 22.5% event rate \u2014 is not attainable on a genuine forward-looking consumer default problem and is, in our assessment, the signature of target leakage through the predictor `pay_amt_next`. Every downstream outcome in this report is contaminated by that defect, so the discrimination, calibration and stability results below should be read as descriptions of a leaking model, not as evidence of predictive skill.",
      "value": 22.5,
      "unit": "percent",
      "metric": "event_rate",
      "split": "test",
      "comparison": "eq",
      "citation": null,
      "rounding": null,
      "section": "summary",
      "id": "28c7d2b81c103020",
      "source": "report",
      "status": "unsupported",
      "artifact_value": null,
      "tolerance": 0.05
    },
    {
      "text": "The choice of a logistic regression on standardised inputs is appropriate for a regulated credit-risk application: it is transparent, its coefficients are directly interpretable as standardised log-odds effects, and it supports the sign and magnitude review that follows. The developer applied a variance-inflation screen at a declared threshold of 10.0 and removed `bill_last` (VIF 162.93) and `utilisation_mean_6m` (VIF 36.78) [[art:e4b3fd0e:run.model_summary#removed]]. That is sound practice and is documented.",
      "value": 10.0,
      "unit": "ratio",
      "metric": "vif",
      "split": null,
      "comparison": "eq",
      "citation": "[[art:e4b3fd0e:run.model_summary#removed]]",
      "rounding": null,
      "section": "conceptual_soundness",
      "id": "5bf89942ada4f519",
      "source": "report",
      "status": "dangling",
      "artifact_value": null,
      "tolerance": 0.0
    },
    {